{
  "schema_version": 1,
  "genre": "thriller",
  "research_date": "2026-10-26",
  "candidates": [
    {
      "imdb_id": "tt5729348",
      "type": "movie",
      "title": "Memoir of a Murderer",
      "year": 2017,
      "reason": "In the 118-minute theatrical film, former serial killer Kim Byeong-soo has dementia and fears that he may be responsible for new murders, while a suspicious collision with a bloodstained car points him toward policeman Tae-joo, who begins dating his daughter. The evidence and his understanding change at several points: a blood sample and number plate implicate Tae-joo, an altered memoir and swapped evidence undermine Byeong-soo's account, a forgotten week and a supposedly safe relative expose serious gaps in his memory, and a dropped recorder later preserves a confession that his mind could not. The recovered truth about his own earlier crimes and the final confrontation further reframe his apparent protectiveness. Thus real clues and answers recur across the beginning, middle and final act, although the story repeatedly pauses for dementia and family tragedy, and uncertainty itself sometimes substitutes for a new verified answer. The Reel Bits praises the unreliable-narrator tension and photography but questions the logic of some twists; AsianMovieWeb praises the performance and suspense while finding the subplots unfocused and some revelations predictable. The separate director's cut adds roughly ten minutes and materially changes the ending, so its more radical final ambiguity must not be assumed to describe the standard theatrical cut. This is a serial-killer psychological puzzle and pursuit, not a broad institutional conspiracy or a nonstop police procedural.",
      "sources": [
        {
          "url": "https://www.imdb.com/title/tt5729348/",
          "purpose": "identity"
        },
        {
          "url": "https://en.wikipedia.org/wiki/Memoir_of_a_Murderer",
          "purpose": "whole_runtime"
        },
        {
          "url": "https://thereelbits.com/2017/09/22/review-memoir-of-a-murderer/",
          "purpose": "review"
        },
        {
          "url": "https://www.asianmovieweb.com/de/reviews/memoir_of_a_murderer.htm",
          "purpose": "review"
        },
        {
          "url": "https://filmchecker.wordpress.com/2021/07/14/filmkritik-memoir-of-a-murderer-2017/",
          "purpose": "review"
        }
      ],
      "dna": {
        "mystery": 8,
        "investigation": 6,
        "clue_puzzling": 7,
        "culprit_hunt": 8,
        "progressive_revelation": 7,
        "revelation_frequency": 6,
        "plot_twists": 8,
        "psychological_strategy": 7,
        "cat_and_mouse": 8,
        "deception": 8,
        "hidden_identity": 5,
        "unreliable_perspective": 9,
        "conspiracy": 0,
        "mole_inside": 4,
        "corruption": 1,
        "surveillance": 2,
        "evidence_manipulation": 8,
        "technology_threat": 0,
        "suspense": 8,
        "action_density": 4,
        "action_intensity": 7,
        "brutality": 8,
        "deadly_game": 0,
        "weirdness": 6,
        "military_focus": 0,
        "romance_focus": 2,
        "drama_focus": 6,
        "visual_quality": 8,
        "retro_visual_style": 2,
        "pace_speed": 7
      },
      "dna_confidence": 0.85,
      "dna_tags": [
        "serial_killer"
      ]
    },
    {
      "imdb_id": "tt6908274",
      "type": "movie",
      "title": "Mirage",
      "year": 2018,
      "reason": "In Oriol Paulo's 128-minute Spanish thriller, Vera's warning to a boy through a television during a repeated electrical storm saves his life in 1989 but rewrites her 2014 life so that her daughter has never existed. Her attempt to recover the child develops alongside an actual cold murder inquiry: she seeks police help, provides a testable lead to a body hidden beneath a slaughterhouse, and the discovered remains expose a concealed affair and falsified disappearance. The inquiry into the rescued boy's later life then yields another consequential identity revelation about the inspector assisting her, explaining why her relationships and family history changed; a final intervention reshapes the timeline once more. These are distributed discoveries in the opening, middle and late film rather than a single last-minute twist, but the investigation competes with extensive maternal distress, romance and alternate-life melodrama, so mystery and revelation cadence should not be conflated with nonstop detective work. The Hollywood Reporter review excerpt collected by Rotten Tomatoes praises the intricate construction while finding limited depth, and other critics there question the length and whether the emotional story overwhelms the thriller. The camera/television mechanism enables the time anomaly, but is not a malicious technological antagonist; the period scenes do not make the overall film's visual craft retro or cheap.",
      "sources": [
        {
          "url": "https://www.imdb.com/title/tt6908274/",
          "purpose": "identity"
        },
        {
          "url": "https://www.imdb.com/title/tt6908274/plotsummary/",
          "purpose": "whole_runtime"
        },
        {
          "url": "https://www.rottentomatoes.com/m/mirage_2019",
          "purpose": "review"
        },
        {
          "url": "https://en.wikipedia.org/wiki/Mirage_(2018_film)",
          "purpose": "structure"
        }
      ],
      "dna": {
        "mystery": 8,
        "investigation": 7,
        "clue_puzzling": 8,
        "culprit_hunt": 5,
        "progressive_revelation": 8,
        "revelation_frequency": 7,
        "plot_twists": 8,
        "psychological_strategy": 5,
        "cat_and_mouse": 4,
        "deception": 7,
        "hidden_identity": 7,
        "unreliable_perspective": 7,
        "conspiracy": 1,
        "mole_inside": 1,
        "corruption": 0,
        "surveillance": 3,
        "evidence_manipulation": 7,
        "technology_threat": 4,
        "suspense": 8,
        "action_density": 3,
        "action_intensity": 5,
        "brutality": 5,
        "deadly_game": 0,
        "weirdness": 9,
        "military_focus": 0,
        "romance_focus": 6,
        "drama_focus": 6,
        "visual_quality": 8,
        "retro_visual_style": 3,
        "pace_speed": 7
      },
      "dna_confidence": 0.84,
      "dna_tags": [
        "cold_case"
      ]
    }
  ],
  "research_rejections": []
}
