{
  "schema_version": 1,
  "genre": "thriller",
  "research_date": "2026-10-03",
  "candidates": [
    {
      "imdb_id": "tt38448408",
      "type": "series",
      "title": "The Killings: Parrish Station",
      "year": 2026,
      "reason": "A complete six-episode dual-timeline murder mystery whose structure strongly matches the profile: Georgia Cooke investigates the 1987 massacre and, decades later, copycat killings reopen the case. The episode progression supplies meaningful information throughout rather than reserving everything for the finale: the Bone Gospel is established as real, a present-day podcaster body extends the copycat case, an older similar case is uncovered, evidence links the murder mysteries, the ritual and signal become concrete, and the penultimate episode identifies that the killer has been close to the investigators before the finale becomes a race to stop Callum Parrish. The Guardian independently characterizes the series as a murder mystery packed with twists and outlandish momentum. The main weakness is that the occult/cosmic-horror explanation makes the clue chain less grounded than a conventional procedural, and interpersonal estrangement/obsession adds a substantial drama layer, but the complete-season evidence supports frequent progressive answers, active investigation, mystery, culprit pursuit and sustained suspense.",
      "sources": [
        {
          "url": "https://www.imdb.com/title/tt38448408/",
          "purpose": "identity"
        },
        {
          "url": "https://www.stan.com.au/watch/the-killings-at-parrish-station",
          "purpose": "whole_runtime"
        },
        {
          "url": "https://www.nowtv.com/watch/the-killings-at-parrish-station/iYEQYZaB7ju6ZNYmCkTz47/seasons/1/episodes/episode-4-episode-4/A5EK4Gos4kywNot4BQuYh",
          "purpose": "structure"
        },
        {
          "url": "https://www.theguardian.com/tv-and-radio/2026/jun/24/the-killings-at-parrish-station-review-tv-show-mystery-drama-stan-australia",
          "purpose": "review"
        }
      ],
      "dna": {
        "mystery": 9,
        "investigation": 9,
        "clue_puzzling": 8,
        "culprit_hunt": 8,
        "progressive_revelation": 8,
        "revelation_frequency": 8,
        "plot_twists": 8,
        "psychological_strategy": 4,
        "cat_and_mouse": 5,
        "deception": 6,
        "hidden_identity": 5,
        "unreliable_perspective": 6,
        "conspiracy": 6,
        "mole_inside": 4,
        "corruption": 2,
        "surveillance": 2,
        "evidence_manipulation": 4,
        "technology_threat": 3,
        "suspense": 8,
        "action_density": 4,
        "action_intensity": 6,
        "brutality": 7,
        "deadly_game": 0,
        "weirdness": 8,
        "military_focus": 0,
        "romance_focus": 1,
        "drama_focus": 7,
        "visual_quality": 8,
        "retro_visual_style": 3,
        "pace_speed": 7
      },
      "dna_confidence": 0.88,
      "dna_tags": [
        "police_procedural",
        "cold_case"
      ]
    }
  ],
  "research_rejections": [
    {
      "title": "Winter",
      "type": "series",
      "year": 2026,
      "imdb_id": null,
      "reason": "Qualitative rejection for now: the ITV crime series only premiered on September 30, 2026 and is releasing as an ongoing series. Current evidence establishes a forensic procedural with an overarching cold-case thread around Simone's murder, but not the complete-season revelation cadence required to measure all Thriller DNA dimensions honestly. Reconsider after the full season has aired."
    },
    {
      "title": "Line of Fire",
      "type": "series",
      "year": 2026,
      "imdb_id": null,
      "reason": "Qualitative rejection for now: season one is a ten-episode weekly release that began September 21, 2026, so complete-season evidence is unavailable. Available reporting describes a conspiracy and cliffhangers but also explicitly frames the show as a family drama/procedural hybrid. Without the full season, progressive revelation and revelation frequency cannot be measured across the complete runtime without inference."
    },
    {
      "title": "Psycho Killer",
      "type": "movie",
      "year": 2026,
      "imdb_id": "tt1764551",
      "reason": "Qualitative rejection: the 91-minute film has a police pursuit, serial-killer hunt, occult clues and brutality, but whole-film critical evidence is strongly unfavorable and specifically describes the plot as obvious with no surprises. The identity and hunt are clear, but available evidence does not support the profile's required high-confidence measurements of progressive revelation and revelation frequency as a strong fit; do not turn a serial-killer pursuit premise into assumed revelation cadence."
    }
  ]
}
