{
  "schema_version": 1,
  "genre": "thriller",
  "research_date": "2026-10-14",
  "candidates": [
    {
      "imdb_id": "tt1937149",
      "type": "movie",
      "title": "The Body",
      "year": 2012,
      "reason": "Oriol Paulo's Spanish morgue mystery is driven by an actual evidence trail rather than a generic crime premise. Across the complete film, the guard's unexplained flight and the missing corpse precede discovery of the TH-16 toxin and Alex's affair; increasingly targeted disturbances suggest Mayka might have survived; the private-investigator lead and the guard's account alter the working theory; police cannot substantiate the alleged mistress Carla's identity; and the recovered body and final identity/revenge disclosure decisively reframe the case. This supports substantial investigation and clue-puzzling, regular but not constant meaningful information, and stronger late plot reversals than continuous progressive revelation. The adversarial staging of clues, deliberate framing and psychological pressure are central. The bulk is claustrophobic questioning and manipulation rather than physical action. Critics disagree on the visual direction (precise atmospheric framing versus repetitive camerawork), and an independent review notes repetitive clue/interrogation cycles in the middle-to-late stretch and a questionable element of the payoff. The final explanation requires some suspension of disbelief; those limitations are reflected in cadence, pace and craft rather than hidden by the strong ending.",
      "sources": [
        {
          "url": "https://www.imdb.com/title/tt1937149/",
          "purpose": "identity"
        },
        {
          "url": "https://www.imdb.com/title/tt1937149/plotsummary/",
          "purpose": "whole_runtime"
        },
        {
          "url": "https://www.filmstarts.de/kritiken/215345/kritik.html",
          "purpose": "review"
        },
        {
          "url": "https://www.thisishorror.co.uk/film-review-body-el-cuerpo-2012/amp/",
          "purpose": "review"
        },
        {
          "url": "https://taz.de/Spanischer-Krimi-The-Body/!5623442/",
          "purpose": "structure"
        }
      ],
      "dna": {
        "mystery": 9,
        "investigation": 8,
        "clue_puzzling": 8,
        "culprit_hunt": 6,
        "progressive_revelation": 7,
        "revelation_frequency": 6,
        "plot_twists": 8,
        "psychological_strategy": 8,
        "cat_and_mouse": 7,
        "deception": 9,
        "hidden_identity": 7,
        "unreliable_perspective": 6,
        "conspiracy": 5,
        "mole_inside": 5,
        "corruption": 0,
        "surveillance": 3,
        "evidence_manipulation": 9,
        "technology_threat": 1,
        "suspense": 8,
        "action_density": 2,
        "action_intensity": 4,
        "brutality": 5,
        "deadly_game": 0,
        "weirdness": 4,
        "military_focus": 0,
        "romance_focus": 3,
        "drama_focus": 4,
        "visual_quality": 7,
        "retro_visual_style": 3,
        "pace_speed": 6
      },
      "dna_confidence": 0.83,
      "dna_tags": [
        "police_procedural",
        "witness"
      ]
    },
    {
      "imdb_id": "tt10530176",
      "type": "movie",
      "title": "The Call",
      "year": 2020,
      "reason": "Lee Chung-hyun's Korean two-timeline thriller repeatedly pays out information and changes its consequences across its entire 112-minute runtime. The phone/diary clues establish that Seo-yeon in 2019 is speaking to Young-sook in 1999; saving Seo-yeon's father transforms the present; the discovery of Young-sook's predicted death, the thwarted exorcism and subsequent murders reveal the escalating threat; disappearing people and the kidnapping of Seo-yeon's younger self convert a friendship into cross-time hostage warfare. Police records, a failed explosion trap, and the revelation about who caused the childhood fire create further changes in both strategy and understanding. The revised notebook and simultaneous past/present confrontations culminate in another timeline reversal, including a contested mid-credits twist. This is genuinely frequent progressive revelation, not merely frequent investigative activity: formal investigation is secondary to tactical phone calls, records research and the antagonist's repeated alteration of history. The violence and psychological cat-and-mouse are pronounced; romance, military themes and rule-bound games are not drivers. Reviews praise brisk overall progression, clear parallel timelines, claustrophobic photography and tension, but independently fault the final reversal for weakening established time-travel logic. Individual scenes sometimes take a measured pace despite the brisk narrative.",
      "sources": [
        {
          "url": "https://www.imdb.com/title/tt10530176/",
          "purpose": "identity"
        },
        {
          "url": "https://www.imdb.com/title/tt10530176/plotsummary/",
          "purpose": "whole_runtime"
        },
        {
          "url": "https://londonkoreanlinks.net/2021/01/08/call-2020-review-hc/",
          "purpose": "review"
        },
        {
          "url": "https://www.dreadcentral.com/reviews/361672/the-call-aka-call-review-one-of-the-scariest-movies-of-2020/",
          "purpose": "review"
        },
        {
          "url": "https://www.rottentomatoes.com/m/the_call_2020_kr",
          "purpose": "review"
        }
      ],
      "dna": {
        "mystery": 7,
        "investigation": 5,
        "clue_puzzling": 6,
        "culprit_hunt": 3,
        "progressive_revelation": 9,
        "revelation_frequency": 9,
        "plot_twists": 9,
        "psychological_strategy": 8,
        "cat_and_mouse": 9,
        "deception": 8,
        "hidden_identity": 2,
        "unreliable_perspective": 7,
        "conspiracy": 2,
        "mole_inside": 0,
        "corruption": 0,
        "surveillance": 3,
        "evidence_manipulation": 7,
        "technology_threat": 7,
        "suspense": 9,
        "action_density": 4,
        "action_intensity": 7,
        "brutality": 8,
        "deadly_game": 0,
        "weirdness": 8,
        "military_focus": 0,
        "romance_focus": 0,
        "drama_focus": 5,
        "visual_quality": 8,
        "retro_visual_style": 2,
        "pace_speed": 8
      },
      "dna_confidence": 0.86,
      "dna_tags": [
        "serial_killer",
        "kidnapping"
      ]
    }
  ],
  "research_rejections": [
    {
      "title": "The Trap",
      "type": "series",
      "year": 2026,
      "imdb_id": null,
      "reason": "The complete six-episode German Netflix miniseries was released October 13, 2026 and is an initially plausible murder-investigation/psychological cat-and-mouse candidate. However, newly available full-season criticism consistently identifies a stretched middle, repetitive rehearsals or exposition, uneven suspense, and a weak or underwhelming resolution despite some intriguing manipulation and a final ambiguity. The episode descriptions show a late confession and final answers, but do not by themselves establish frequent meaningful reframing across the whole season. With this evidence, treating the premise or the finale as proof of high revelation cadence would overstate the fit; retain as a qualitative rejection rather than inventing complete 30-dimension measurements. Sources consulted: https://www.netflix.com/fk/title/81720671 ; https://readysteadycut.com/2026/10/13/the-trap-season-1-review/ ; https://www.moviepilot.de/news/die-falle-bei-netflix-liebes-kind-kritik-1164397 ; https://www.heavenofhorror.com/reviews/the-trap-2026-netflix-series/ ."
    }
  ]
}
