{
  "schema_version": 1,
  "genre": "thriller",
  "research_date": "2026-10-27",
  "candidates": [
    {
      "imdb_id": "tt14527836",
      "type": "movie",
      "title": "Recalled",
      "year": 2021,
      "reason": "Across its 99-minute South Korean psychological mystery, Soo-jin wakes with amnesia after an apparent accident and experiences disturbing visions that seem to predict dangers to other people. Her apparent husband Ji-hoon restricts what she knows, tracks her movements and presses plans to move to Canada, creating immediate uncertainty about whether the visions are supernatural, unreliable or buried memories. Meaningful information arrives in successive portions of the film: an apparently accurate vision of a child's road accident, a construction-site police inquiry and CCTV implicating Ji-hoon, a former colleague's account of Soo-jin's troubled marriage, photographs of an unfamiliar man and fragments of an earlier fall. Later disclosures identify the supposed husband as her protective adoptive brother, distinguish him from her actual husband and explain the violent events preceding her memory loss; the supposed premonitions are reinterpreted through recovered memories. Forbes and Cinema Escapist specifically describe rapidly paced revisions to the viewer's understanding, while the longer review at MIB details intermediate evidence rather than only a final twist. The counterweight is that the scenario uses familiar amnesia and domestic-abuse tropes and is less demanding as a clue puzzle than its sustained reversals imply. It is primarily an unreliable-perspective mystery and tense identity deception, not a conventional police procedural or a technology-driven conspiracy; intermittent construction-site peril is not nonstop action.",
      "sources": [
        {
          "url": "https://www.imdb.com/title/tt14527836/",
          "purpose": "identity"
        },
        {
          "url": "https://www.forbes.com/sites/joanmacdonald/2021/04/25/seo-ye-ji-cant-trust-memories-or-visions-in-tense-thriller-recalled/",
          "purpose": "review"
        },
        {
          "url": "https://www.cinemaescapist.com/2021/05/review-recalled-korean-movie/",
          "purpose": "review"
        },
        {
          "url": "https://mibih.wordpress.com/2021/09/27/movie-review-recalled/",
          "purpose": "review"
        },
        {
          "url": "https://www.plotexplained.com/movie/recalled-2021/ending",
          "purpose": "whole_runtime"
        }
      ],
      "dna": {
        "mystery": 9,
        "investigation": 6,
        "clue_puzzling": 7,
        "culprit_hunt": 4,
        "progressive_revelation": 8,
        "revelation_frequency": 8,
        "plot_twists": 9,
        "psychological_strategy": 7,
        "cat_and_mouse": 7,
        "deception": 9,
        "hidden_identity": 9,
        "unreliable_perspective": 9,
        "conspiracy": 0,
        "mole_inside": 0,
        "corruption": 0,
        "surveillance": 6,
        "evidence_manipulation": 8,
        "technology_threat": 2,
        "suspense": 8,
        "action_density": 4,
        "action_intensity": 6,
        "brutality": 6,
        "deadly_game": 0,
        "weirdness": 8,
        "military_focus": 0,
        "romance_focus": 2,
        "drama_focus": 5,
        "visual_quality": 8,
        "retro_visual_style": 1,
        "pace_speed": 8
      },
      "dna_confidence": 0.84,
      "dna_tags": [
        "amnesia"
      ]
    },
    {
      "imdb_id": "tt3140100",
      "type": "movie",
      "title": "The Absent One",
      "year": 2014,
      "reason": "The 119-minute Danish Department Q mystery reopens the 1994 murders of twins after their father leaves a case file for detective Carl Morck. The original conviction appears suspicious: a working-class suspect received an unusually light sentence and elite legal representation, while an old emergency call and photographs connect wealthy former boarding-school students to a missing witness, Kimmie. The parallel flashbacks disclose aspects of the original violence before investigators can prove them, so the suspense partly concerns catching and protecting people rather than guessing the killers. Further consequential findings span the middle and late story: hospital records illuminate Kimmie's disappearance, the police commissioner's school ties explain leaks to the suspects, and a disclosure about trophies kept by one suspect directs detectives to physical evidence. The inquiry becomes a race to reach the witness before the powerful former students and their hired pursuer do. The Guardian explicitly praises clues and revelations throughout, while Time Out notes that the villains are easy to suspect early, and Rotten Tomatoes' collected criticism points to formulaic genre devices and an overwrought climax. Thus the cold-case investigation and recurring evidence are strong, but the revelation cadence is lower than a wholly unpredictable whodunit and the action is episodic. The shadowy, polished cinematography is distinct from its familiar Nordic-noir visual styling; the plot's police insider and elite cover-up support real corruption without a vast geopolitical conspiracy.",
      "sources": [
        {
          "url": "https://www.imdb.com/title/tt3140100/",
          "purpose": "identity"
        },
        {
          "url": "https://en.wikipedia.org/wiki/The_Absent_One_(2014_film)",
          "purpose": "whole_runtime"
        },
        {
          "url": "https://www.theguardian.com/film/2016/apr/07/the-absent-one-review-danish-crime-mystery-department-q",
          "purpose": "review"
        },
        {
          "url": "https://www.timeout.com/movies/the-absent-one",
          "purpose": "review"
        },
        {
          "url": "https://www.rottentomatoes.com/m/the_absent_one",
          "purpose": "review"
        }
      ],
      "dna": {
        "mystery": 8,
        "investigation": 9,
        "clue_puzzling": 8,
        "culprit_hunt": 6,
        "progressive_revelation": 7,
        "revelation_frequency": 7,
        "plot_twists": 7,
        "psychological_strategy": 6,
        "cat_and_mouse": 7,
        "deception": 8,
        "hidden_identity": 3,
        "unreliable_perspective": 3,
        "conspiracy": 7,
        "mole_inside": 7,
        "corruption": 8,
        "surveillance": 3,
        "evidence_manipulation": 8,
        "technology_threat": 0,
        "suspense": 8,
        "action_density": 4,
        "action_intensity": 7,
        "brutality": 8,
        "deadly_game": 0,
        "weirdness": 4,
        "military_focus": 0,
        "romance_focus": 3,
        "drama_focus": 5,
        "visual_quality": 8,
        "retro_visual_style": 4,
        "pace_speed": 7
      },
      "dna_confidence": 0.86,
      "dna_tags": [
        "cold_case",
        "police_procedural",
        "witness"
      ]
    }
  ],
  "research_rejections": [
    {
      "title": "Intruder",
      "type": "movie",
      "year": 2020,
      "reason": "The initial home-infiltration mystery is tense, but Yonhap's contemporary review says the explanation of the intruder's plan is delivered in one concentrated stretch and the final act fails to sustain tension. Insufficient distributed meaningful revelations for this research packet."
    },
    {
      "title": "The Collini Case",
      "type": "movie",
      "year": 2019,
      "imdb_id": "tt8739752",
      "reason": "The courtroom motive inquiry and historical investigation are substantial, but multiple critical reviews identify the decisive explanation as concentrated in the last act, with considerable legal and personal drama before it. Not selected over stronger evidence of distributed revelations."
    }
  ]
}
