{
  "schema_version": 1,
  "genre": "thriller",
  "research_date": "2026-10-17",
  "candidates": [
    {
      "imdb_id": "tt0362225",
      "type": "movie",
      "title": "Tell No One",
      "year": 2006,
      "reason": "Alexandre Beck's apparently murdered wife appears in new surveillance footage just as buried bodies and incriminating objects reopen the case. Across the film, cryptic emails, disputed forensic evidence, a safe-deposit-box trail, police pursuit, threats from hired criminals and the possibility of institutional protection progressively widen the mystery. A final confrontation exposes the staged death, the conspiracy and conflicting accounts of an earlier killing. The complete-film synopsis and Ebert's account support meaningful intermediate clues and reversals, not simply an investigation with no payoff; however, Screen Daily observes that a long climactic explanation supplies much of the ultimate causal picture and that tension flags in the last third. The New Yorker also describes the truth arriving in small increments. This is a sustained wrong-man chase, clue puzzle and corruption mystery with some violent action and emotional memories, but its crowded cast, contrived connections and backloaded explanation limit the revelation-cadence assessment.",
      "sources": [
        {
          "url": "https://www.imdb.com/title/tt0362225/",
          "purpose": "identity"
        },
        {
          "url": "https://www.imdb.com/title/tt0362225/plotsummary/",
          "purpose": "whole_runtime"
        },
        {
          "url": "https://www.rogerebert.com/reviews/tell-no-one-2008",
          "purpose": "review"
        },
        {
          "url": "https://www.screendaily.com/tell-no-one-ne-le-dis-a-personne/4029546.article",
          "purpose": "review"
        },
        {
          "url": "https://www.newyorker.com/magazine/2008/07/07/desperate-men",
          "purpose": "review"
        }
      ],
      "dna": {
        "mystery": 9,
        "investigation": 8,
        "clue_puzzling": 8,
        "culprit_hunt": 6,
        "progressive_revelation": 7,
        "revelation_frequency": 6,
        "plot_twists": 8,
        "psychological_strategy": 7,
        "cat_and_mouse": 8,
        "deception": 9,
        "hidden_identity": 7,
        "unreliable_perspective": 4,
        "conspiracy": 8,
        "mole_inside": 5,
        "corruption": 8,
        "surveillance": 6,
        "evidence_manipulation": 9,
        "technology_threat": 3,
        "suspense": 9,
        "action_density": 5,
        "action_intensity": 7,
        "brutality": 7,
        "deadly_game": 0,
        "weirdness": 3,
        "military_focus": 0,
        "romance_focus": 4,
        "drama_focus": 5,
        "visual_quality": 8,
        "retro_visual_style": 4,
        "pace_speed": 7
      },
      "dna_confidence": 0.86,
      "dna_tags": [
        "police_procedural",
        "witness"
      ]
    },
    {
      "imdb_id": "tt7550014",
      "type": "movie",
      "title": "No Exit",
      "year": 2022,
      "reason": "Darby discovers a kidnapped child in a van outside a snowbound rest stop and initially questions four stranded strangers to identify the culprit. The complete-film account shows the first suspect identified relatively early, followed by a second accomplice reveal, a disclosure about the trafficking destination and a later betrayal by a seemingly helpful insider. Those discoveries do reframe whom Darby can trust at several stages, but most of the later runtime is a violent escape-and-countermove struggle rather than sustained evidence investigation. Ebert explicitly notes the early disclosure of the apparent central answer alongside several later chapter-like twists; the Los Angeles Times describes further surprises but doubts the film's thematic payoff, while The Guardian finds the early reveal drains the guessing game and the subsequent survival conflict repetitive. Thus suspense, deception, danger and action are stronger than deep clue-puzzling or continuously progressive revelation. The compact setting, escalating brutality and contemporary production are assets, offset by contrivances, thin characterisation and uneven tonal control.",
      "sources": [
        {
          "url": "https://www.imdb.com/title/tt7550014/",
          "purpose": "identity"
        },
        {
          "url": "https://www.imdb.com/title/tt7550014/plotsummary/",
          "purpose": "whole_runtime"
        },
        {
          "url": "https://www.rogerebert.com/reviews/no-exit-movie-review-2022",
          "purpose": "review"
        },
        {
          "url": "https://www.theguardian.com/film/2022/feb/25/no-exit-review-havana-rose-liu-hulu",
          "purpose": "review"
        },
        {
          "url": "https://www.rottentomatoes.com/m/no_exit_2022",
          "purpose": "review"
        }
      ],
      "dna": {
        "mystery": 6,
        "investigation": 4,
        "clue_puzzling": 5,
        "culprit_hunt": 7,
        "progressive_revelation": 5,
        "revelation_frequency": 6,
        "plot_twists": 7,
        "psychological_strategy": 7,
        "cat_and_mouse": 8,
        "deception": 8,
        "hidden_identity": 5,
        "unreliable_perspective": 2,
        "conspiracy": 3,
        "mole_inside": 7,
        "corruption": 0,
        "surveillance": 1,
        "evidence_manipulation": 4,
        "technology_threat": 1,
        "suspense": 8,
        "action_density": 7,
        "action_intensity": 8,
        "brutality": 8,
        "deadly_game": 0,
        "weirdness": 2,
        "military_focus": 1,
        "romance_focus": 0,
        "drama_focus": 3,
        "visual_quality": 7,
        "retro_visual_style": 1,
        "pace_speed": 8
      },
      "dna_confidence": 0.85,
      "dna_tags": [
        "kidnapping",
        "survival_game"
      ]
    }
  ],
  "research_rejections": [
    {
      "title": "The Hidden Face",
      "type": "movie",
      "year": 2011,
      "imdb_id": "tt1772250",
      "reason": "Its central missing-person puzzle turns on a concealed room and a major mid-film perspective change, after which the narrative chiefly follows captivity, jealousy and a final role reversal. The complete IMDb plot and Variety review represented on Rotten Tomatoes do not establish that meaningful answers repeatedly accumulate across the entire runtime; the critic calls the thrills consecutive rather than cumulative. The film has suspense and strong isolated twists, but the evidence for sustained progressive revelation is weaker than for the staged candidates."
    }
  ]
}
