{
  "schema_version": 1,
  "genre": "thriller",
  "research_date": "2026-10-20",
  "candidates": [
    {
      "imdb_id": "tt6904272",
      "type": "movie",
      "title": "The Negotiation",
      "year": 2018,
      "reason": "A failed opening hostage rescue leaves police negotiator Ha Chae-youn shaken before an arms dealer, Min Tae-gu, demands to speak exclusively with her during a new hostage crisis. Across the complete film, his apparently arbitrary demands expose a progressively more complicated scheme: one apparent journalist is an undercover intelligence agent, a supposedly straightforward kidnapping is linked to an earlier killing, the hostage taker's personal motive emerges, and compromised police, political and corporate officials try to suppress evidence and manage a raid. Each discovery changes the negotiator's understanding of whom she can trust and what Min is trying to accomplish. The central engine is psychological bargaining over a video link rather than a conventional culprit hunt or sustained physical action; the later action and military response are episodic. Yonhap describes gradually revealed intentions and successive twists, while Cinema Escapist highlights recurring information and brisk tension. The contrary critical evidence matters: Rotten Tomatoes quotes reviews faulting a predictable corruption story, implausible institutional behavior, stretches of talk and an exposition-heavy final act. Thus the movie's cat-and-mouse and suspense are stronger than its clue-puzzling or perfectly even revelation cadence. Its arms-dealer background and security response do not make it a military-operations-first film.",
      "sources": [
        {
          "url": "https://www.imdb.com/title/tt6904272/",
          "purpose": "identity"
        },
        {
          "url": "https://en.wikipedia.org/wiki/The_Negotiation_(film)",
          "purpose": "whole_runtime"
        },
        {
          "url": "https://en.yna.co.kr/view/AEN20180911008600315",
          "purpose": "review"
        },
        {
          "url": "https://www.cinemaescapist.com/2018/09/review-the-negotiation-korean-movie-hyun-bin/",
          "purpose": "review"
        },
        {
          "url": "https://www.rottentomatoes.com/m/the_negotiation",
          "purpose": "review"
        }
      ],
      "dna": {
        "mystery": 7,
        "investigation": 6,
        "clue_puzzling": 6,
        "culprit_hunt": 2,
        "progressive_revelation": 7,
        "revelation_frequency": 7,
        "plot_twists": 7,
        "psychological_strategy": 9,
        "cat_and_mouse": 9,
        "deception": 8,
        "hidden_identity": 6,
        "unreliable_perspective": 3,
        "conspiracy": 8,
        "mole_inside": 6,
        "corruption": 9,
        "surveillance": 7,
        "evidence_manipulation": 6,
        "technology_threat": 3,
        "suspense": 8,
        "action_density": 4,
        "action_intensity": 8,
        "brutality": 7,
        "deadly_game": 0,
        "weirdness": 2,
        "military_focus": 3,
        "romance_focus": 0,
        "drama_focus": 4,
        "visual_quality": 7,
        "retro_visual_style": 1,
        "pace_speed": 8
      },
      "dna_confidence": 0.84,
      "dna_tags": [
        "kidnapping",
        "undercover"
      ]
    },
    {
      "imdb_id": "tt5144174",
      "type": "movie",
      "title": "The Dry",
      "year": 2020,
      "reason": "Federal investigator Aaron Falk returns to his drought-stricken hometown after a friend's apparent family murder-suicide and reopens an older mystery about the drowning of a teenage girl. The 117-minute film develops two intertwined investigations through scene reconstruction, ammunition that does not match the family's weapons, CCTV, hostile witnesses, memories of an old alibi, a note marked 'grant?' and school-funding documents. The meaning of 'grant' changes from a suspect's name to financial funding, redirecting suspicion toward embezzlement; a late confession resolves the recent murders, and the girl's recovered diary reframes the decades-old death. The full IMDb synopsis supports these clues across the opening, middle and end, while RogerEbert.com specifically notes that fragmented flashbacks slowly supply information and encourage the viewer to interpret evidence. The Guardian praises polished, gripping suspense but notes a succession of red herrings and reveals near the end. Investigation and clue-puzzling are therefore high, yet revelation frequency is more moderate than the dual-mystery premise alone might suggest: atmosphere, grief, community hostility and flashback drama occupy significant runtime, and the biggest answers are backloaded. The film is a slow-burning small-town mystery rather than an action-heavy chase or psychological duel. The cinematography and dusty landscape are deliberate high-quality craft, not a cheap presentation.",
      "sources": [
        {
          "url": "https://www.imdb.com/title/tt5144174/",
          "purpose": "identity"
        },
        {
          "url": "https://www.imdb.com/title/tt5144174/plotsummary/",
          "purpose": "whole_runtime"
        },
        {
          "url": "https://www.rogerebert.com/reviews/the-dry-movie-review-2021",
          "purpose": "review"
        },
        {
          "url": "https://www.theguardian.com/film/2020/dec/31/the-dry-review-",
          "purpose": "review"
        },
        {
          "url": "https://en.wikipedia.org/wiki/The_Dry_(film)",
          "purpose": "structure"
        }
      ],
      "dna": {
        "mystery": 9,
        "investigation": 8,
        "clue_puzzling": 8,
        "culprit_hunt": 7,
        "progressive_revelation": 6,
        "revelation_frequency": 6,
        "plot_twists": 7,
        "psychological_strategy": 4,
        "cat_and_mouse": 3,
        "deception": 7,
        "hidden_identity": 3,
        "unreliable_perspective": 5,
        "conspiracy": 1,
        "mole_inside": 0,
        "corruption": 2,
        "surveillance": 2,
        "evidence_manipulation": 6,
        "technology_threat": 0,
        "suspense": 7,
        "action_density": 2,
        "action_intensity": 6,
        "brutality": 6,
        "deadly_game": 0,
        "weirdness": 2,
        "military_focus": 0,
        "romance_focus": 3,
        "drama_focus": 6,
        "visual_quality": 8,
        "retro_visual_style": 2,
        "pace_speed": 5
      },
      "dna_confidence": 0.86,
      "dna_tags": [
        "police_procedural",
        "small_town",
        "cold_case"
      ]
    }
  ],
  "research_rejections": []
}
