{
  "schema_version": 1,
  "genre": "thriller",
  "research_date": "2026-10-16",
  "candidates": [
    {
      "imdb_id": "tt0309698",
      "type": "movie",
      "title": "Identity",
      "year": 2003,
      "reason": "A storm strands ten apparent strangers at a motel, where sequential murders, numbered room keys, disappearing bodies and conflicting suspicions make the culprit hunt a sustained puzzle. A parallel last-minute hearing for Malcolm Rivers becomes an explanatory thread, and the motel events' relationship to that hearing eventually reframes the entire scenario; a final killer-identity reversal follows. The film therefore has recurring clues and suspect changes, but the most consequential reframing is concentrated in its later portion, so high twist impact must not be confused with near-constant progressive revelation. Ebert describes the motel murders and hearing as intercut strands; the complete IMDb synopsis resolves both, while Slant identifies an initially taut whodunit but argues that the final psychological explanation is implausible and unsatisfying. Dark, controlled motel staging and brisk crosscutting support suspense, while limited physical action and disputed final logic are material weaknesses.",
      "sources": [
        {
          "url": "https://www.imdb.com/title/tt0309698/",
          "purpose": "identity"
        },
        {
          "url": "https://www.imdb.com/title/tt0309698/plotsummary/",
          "purpose": "whole_runtime"
        },
        {
          "url": "https://www.rogerebert.com/reviews/identity-2003",
          "purpose": "review"
        },
        {
          "url": "https://www.slantmagazine.com/film/identity/",
          "purpose": "review"
        },
        {
          "url": "https://www.cineman.ch/movie/2003/Identity/review.html",
          "purpose": "review"
        }
      ],
      "dna": {
        "mystery": 9,
        "investigation": 7,
        "clue_puzzling": 8,
        "culprit_hunt": 9,
        "progressive_revelation": 6,
        "revelation_frequency": 6,
        "plot_twists": 8,
        "psychological_strategy": 5,
        "cat_and_mouse": 6,
        "deception": 8,
        "hidden_identity": 7,
        "unreliable_perspective": 9,
        "conspiracy": 0,
        "mole_inside": 0,
        "corruption": 0,
        "surveillance": 0,
        "evidence_manipulation": 6,
        "technology_threat": 0,
        "suspense": 8,
        "action_density": 3,
        "action_intensity": 6,
        "brutality": 7,
        "deadly_game": 1,
        "weirdness": 8,
        "military_focus": 0,
        "romance_focus": 1,
        "drama_focus": 3,
        "visual_quality": 7,
        "retro_visual_style": 5,
        "pace_speed": 7
      },
      "dna_confidence": 0.85,
      "dna_tags": [
        "serial_killer"
      ]
    },
    {
      "imdb_id": "tt1614989",
      "type": "movie",
      "title": "Headhunters",
      "year": 2011,
      "reason": "Roger Brown's planned Rubens theft turns into an escalating pursuit by Clas Greve. New discoveries are distributed across the film: the suspected affair, Ove's poisoning, Greve's apparent ability to track Roger, a GPS-gel explanation, Lotte's concealed allegiance and the corporate-espionage motive. Roger's countermeasures culminate in deliberately manipulated security footage and a staged police narrative. The complete IMDb synopsis supports repeated causal revelations and tactical reversals rather than a single finale-only twist; Ebert emphasizes its labyrinth of double-crosses and sustained chase, while Critic's Notebook praises pace, violence and midflight reassessment of characters. Its first stretch emphasizes heist setup and marital insecurity more than investigation, and its later explanations are tidier than some critics accept. The Guardian criticizes the gore and tonal disjunction. Military background describes Greve, but the story is not a military-operations thriller.",
      "sources": [
        {
          "url": "https://www.imdb.com/title/tt1614989/",
          "purpose": "identity"
        },
        {
          "url": "https://www.imdb.com/title/tt1614989/plotsummary/",
          "purpose": "whole_runtime"
        },
        {
          "url": "https://www.rogerebert.com/reviews/headhunters-2012",
          "purpose": "review"
        },
        {
          "url": "https://www.criticsnotebook.com/headhunters-movie-review-morten-tyldum-aksel-hennie-jo-nesbo-norway-hodejegerne/",
          "purpose": "review"
        },
        {
          "url": "https://www.theguardian.com/film/2012/apr/05/headhunters-review",
          "purpose": "review"
        }
      ],
      "dna": {
        "mystery": 6,
        "investigation": 5,
        "clue_puzzling": 6,
        "culprit_hunt": 3,
        "progressive_revelation": 7,
        "revelation_frequency": 7,
        "plot_twists": 8,
        "psychological_strategy": 8,
        "cat_and_mouse": 9,
        "deception": 9,
        "hidden_identity": 6,
        "unreliable_perspective": 3,
        "conspiracy": 7,
        "mole_inside": 7,
        "corruption": 4,
        "surveillance": 8,
        "evidence_manipulation": 8,
        "technology_threat": 6,
        "suspense": 9,
        "action_density": 7,
        "action_intensity": 8,
        "brutality": 8,
        "deadly_game": 0,
        "weirdness": 4,
        "military_focus": 2,
        "romance_focus": 4,
        "drama_focus": 5,
        "visual_quality": 8,
        "retro_visual_style": 2,
        "pace_speed": 8
      },
      "dna_confidence": 0.87,
      "dna_tags": [
        "heist",
        "espionage"
      ]
    }
  ],
  "research_rejections": []
}
