{
  "schema_version": 1,
  "genre": "thriller",
  "research_date": "2026-10-24",
  "candidates": [
    {
      "imdb_id": "tt2969522",
      "type": "movie",
      "title": "Montage",
      "year": 2013,
      "reason": "The 119-120-minute South Korean kidnapping mystery links an unresolved child abduction to a seemingly identical crime fifteen years later. A flower left at the old crime scene and captured on a traffic camera creates a fresh lead just before the statute of limitations expires. After a new child disappears, the retired investigator notices inconsistencies in the apparently straightforward case and disputes his colleagues' premature conclusion. Flashbacks, conflicting evidence and the suspicious grandfather gradually connect the two crimes. The later disclosures identify the grandfather as the original abductor and the bereaved mother as the person who recreated the kidnapping to force a confession; the original death and the motive are explained at the end. These clues and changing suspicions provide genuine investigation and some mid-story reframing, but the most decisive answers remain late. Modern Korean Cinema explicitly describes a leisurely pace and deliberate withholding of information, while AsianMovieWeb praises the coherent twists and suspense but notes familiar genre devices and occasional implausible police handling of evidence. The film therefore rates more strongly for mystery and clue work than for nonstop revelation or action. Its grief and revenge dilemma are substantial without turning it into primarily a relationship drama.",
      "sources": [
        {
          "url": "https://www.imdb.com/title/tt2969522/",
          "purpose": "identity"
        },
        {
          "url": "https://en.wikipedia.org/wiki/Montage_(2013_film)",
          "purpose": "whole_runtime"
        },
        {
          "url": "https://www.asianmovieweb.com/en/reviews/montage.htm",
          "purpose": "review"
        },
        {
          "url": "https://modernkoreancinema.wordpress.com/2013/12/10/review-montage-is-a-refreshing-and-suspenseful-addition-to-the-thriller-genre/",
          "purpose": "review"
        },
        {
          "url": "https://asianwiki.com/Montage_-_Korean_Movie",
          "purpose": "structure"
        }
      ],
      "dna": {
        "mystery": 9,
        "investigation": 8,
        "clue_puzzling": 8,
        "culprit_hunt": 8,
        "progressive_revelation": 7,
        "revelation_frequency": 6,
        "plot_twists": 8,
        "psychological_strategy": 7,
        "cat_and_mouse": 6,
        "deception": 8,
        "hidden_identity": 5,
        "unreliable_perspective": 5,
        "conspiracy": 0,
        "mole_inside": 0,
        "corruption": 1,
        "surveillance": 4,
        "evidence_manipulation": 7,
        "technology_threat": 0,
        "suspense": 8,
        "action_density": 2,
        "action_intensity": 5,
        "brutality": 7,
        "deadly_game": 0,
        "weirdness": 4,
        "military_focus": 0,
        "romance_focus": 0,
        "drama_focus": 5,
        "visual_quality": 8,
        "retro_visual_style": 3,
        "pace_speed": 6
      },
      "dna_confidence": 0.86,
      "dna_tags": [
        "kidnapping",
        "cold_case",
        "police_procedural"
      ]
    },
    {
      "imdb_id": "tt22375054",
      "type": "movie",
      "title": "Strange Darling",
      "year": 2023,
      "reason": "This 96-minute psychological crime thriller is presented as six chapters in the order 3, 5, 1, 4, 2, 6, followed by an epilogue. It first shows a wounded woman fleeing an armed man, then revisits their motel encounter and the farmhouse pursuit from earlier moments. Incremental contextual changes initially undermine the viewer's assumptions; the central revelation in Chapter 2 establishes that the apparent victim is the serial murderer and that her pursuer is a police officer. Chapter 6 then tests that new understanding as she stages herself as a victim to manipulate arriving officers and escape. These are consequential perspective reversals, but the biggest explanatory turn occurs roughly an hour in, after which the remaining story becomes more linear survival and pursuit; do not mistake uninterrupted danger for uninterrupted new answers. The Washington Post praises the taut cat-and-mouse structure and striking 35mm cinematography. Bloody Disgusting praises the early surprises but finds the last chapter comparatively predictable; The Guardian calls the retro-slasher construction too conspicuously tricksy. The film has high deception, unreliable perspective, suspense and brutality, with little conventional evidence-gathering, no broad conspiracy, and a deliberately retro aesthetic that is separate from its polished visual craft.",
      "sources": [
        {
          "url": "https://www.imdb.com/title/tt22375054",
          "purpose": "identity"
        },
        {
          "url": "https://en.wikipedia.org/wiki/Strange_Darling",
          "purpose": "whole_runtime"
        },
        {
          "url": "https://www.washingtonpost.com/entertainment/movies/2024/08/23/strange-darling-ribisi-review/",
          "purpose": "review"
        },
        {
          "url": "https://bloody-disgusting.com/reviews/3779810/strange-darling-fantastic-fest-review/",
          "purpose": "review"
        },
        {
          "url": "https://www.theguardian.com/film/2024/sep/22/strange-darling-review-a-serial-killer-tale-too-tricksy-for-its-own-good",
          "purpose": "review"
        }
      ],
      "dna": {
        "mystery": 8,
        "investigation": 2,
        "clue_puzzling": 5,
        "culprit_hunt": 2,
        "progressive_revelation": 7,
        "revelation_frequency": 6,
        "plot_twists": 9,
        "psychological_strategy": 7,
        "cat_and_mouse": 9,
        "deception": 9,
        "hidden_identity": 7,
        "unreliable_perspective": 9,
        "conspiracy": 0,
        "mole_inside": 0,
        "corruption": 0,
        "surveillance": 0,
        "evidence_manipulation": 6,
        "technology_threat": 0,
        "suspense": 9,
        "action_density": 5,
        "action_intensity": 8,
        "brutality": 9,
        "deadly_game": 0,
        "weirdness": 7,
        "military_focus": 0,
        "romance_focus": 2,
        "drama_focus": 3,
        "visual_quality": 9,
        "retro_visual_style": 7,
        "pace_speed": 8
      },
      "dna_confidence": 0.86,
      "dna_tags": [
        "serial_killer"
      ]
    }
  ],
  "research_rejections": []
}
